begin	begin2	end	end2	gid	gid2	id	id2	matches	s1	s2	seq	seq2	uid	uid2	ch_match	align_len	matches_percentage	w_match	series_b1	series_b2
14	931	773	1500	-8020384904724402078	-6636270028460100563	0845Maqrizi.Muqaffa.Sham19Y0145334-ara1.completed.ms0840	0845Maqrizi.Mawaciz.Shamela0011566-ara1.mARkdown.ms0864	305	امير الجيوش ------سيف -ا-----------لا-سلام --ناصر ال---ا---ما--م- كا--فل --قضاة ال---مسلمين وهادي دعا-ة ال--م-------ءمنين كان مملوكا ارمنيا لجمال الدولة ابي الحسن علي بن عمار صاحب طرابلس الشام فلذلك عرف بالجمالي وما زال ياخذ نفسه بالجد من زمن الشبيبة فيما يباشره ويوطن نفسه علي قوة العزم وينتقل في الخدم الي ان ولي دمشق من قبل المستنصر بالله في يوم الاربعاء الثالث والعشرين من شهر ربيع الاخر سنة خمس وخمسين واربعماءة فتسلمها ومعه الشريف القاضي ثقة الدولة ذو الجلالين ب ابو الحسن يحيي بن زيد الحسيني الزيدي ناظرا في الاعمال واقام بها الي ان خرج منها كالهارب من اهلها في ليلة الثلاثاء لاربع عشرة خلت من شهر رجب سنة ست وخمسين ثم وليها ثانيا يوم الاحد السادس من شعبان سنة ثمان وخمسين فاقام بها الي ان بلغه قتل ولده بعسقلان فخرج منها ونزل علي مسجد القدم خارج دمشق في شهر رمضان سنة ستين واربعماءة فخرج ال---احدا-ث وا	امير الجيوش وبين يديه باشورة قد ركبها الان الناس بالبنيان لما عمر ما خرج عن باب الفتوح امير -الجيوش ابو النجم بدر الجمالي كان مملوكا ارمنيا لجمال الدولة بن عمار --------------------------------فلذلك عرف بالجمالي وما زال ياخذ----- بالجد من زمن --سبي-ه فيما يباشره ويوطن نفسه علي قوة العزم ويتنقل في الخدم حتي ولي امارة دمشق من قبل المستنصر في يوم الاربعاء ثالث عشري ربيع الاخر سنة خمس وستين واربعماءة ثم سار منها كالهارب --------------------------------------------------------------------------------------------------------------------------------------------------في ليلة الثلاثاء لاربع عشرة خلت من---- رجب سنة ست وخمسين ثم وليها ثانيا يوم الاحد سادس شعبان سنة ثمان وخمسين فبلغه قتل ولده شعبان بعسقلان فخرج --------------------------------------------------في شهر رمضان سنة ستين واربعماءة فثار العسكر واخربوا	840	864	6336782052737300608	-8325314868883554181	239	810	37.654319763183594	48	0845Maqrizi.Muqaffa.Sham19Y0145334-ara1.completed	0845Maqrizi.Mawaciz.Shamela0011566-ara1.mARkdown
29	1259	246	1481	-8020384904724402078	-6636270028460100563	0845Maqrizi.Muqaffa.Sham19Y0145334-ara1.completed.ms1535	0845Maqrizi.Mawaciz.Shamela0011566-ara1.mARkdown.ms2108	165	وكان لمساجد القرافة والجبل عنده روزنامج باسماء اربابها -ينفذ اليهم في ايام العنب والتين لكل مسجد قفص تين وقفص عنب وايام الرطب رطبا وفي ليالي الوقودات لكل مسجد خروف شواء وسطل جوذاب وجام حلواء لا سيما اذا كان -------ي-عمل ----ج--فان- -ا	وكان لمساجد القرافة والجبل عنده روزنامج باسماء اربابها فينفد اليهم في ايام العنب والتين لكل مسجد قفص رطب ويرسل في كل ليلة من ليالي الوقود ------------لكل مسجد خروف شواء وسطل جوذاب وجام حلوي ولا سيما اذا كان باءتا في هذا المسجد فانه لا	1535	2108	2280346605816358271	-5418207687319874336	132	234	70.5128173828125	27	0845Maqrizi.Muqaffa.Sham19Y0145334-ara1.completed	0845Maqrizi.Mawaciz.Shamela0011566-ara1.mARkdown
1406	226	1580	404	-8020384904724402078	-6636270028460100563	0845Maqrizi.Muqaffa.Sham19Y0145334-ara1.completed.ms1334	0845Maqrizi.Mawaciz.Shamela0011566-ara1.mARkdown.ms1144	154	م-نين- صلوات الله عليه ومماليكه وليس والله ابرح من موضعي او تنصرفوا عني ولا يلقاني احد الا في القصر فتركوه وانصرفوا واقام --------خدما من الصقالبة الطرادين نوبا علي الطريق -يمن----عون- الناس	مولانا صلوات الله عليه ومماليكه ولست والله ابرح من موضعي او تنصرفوا عني ولا يلقاني احد الا في القصر ف-------انصرفوا واقام بعد ذلك خدما من الصقالبة الطرادي--ن--- علي الطريق بالنوبة لمنع الناس	1334	1144	-4827376971059359643	-4403360370939475102	126	190	81.0526351928711	23	0845Maqrizi.Muqaffa.Sham19Y0145334-ara1.completed	0845Maqrizi.Mawaciz.Shamela0011566-ara1.mARkdown
41	692	366	1097	-8020384904724402078	-6636270028460100563	0845Maqrizi.Muqaffa.Sham19Y0145334-ara1.completed.ms1442	0845Maqrizi.Mawaciz.Shamela0011566-ara1.mARkdown.ms0889	178	م- علي صا-حبيه وقرا فمنهم من قضي نحبه ومنهم من ينتظر وما بدلوا تبديلا الاحزاب وقاتل حتي قتل وبقيت الراية ليس -معها ا--حد -ثم اخذها -عبد- --ال--له بن -وال التيم----------ي--- وق--------اتل- ملي-------ا ثم قال- --لاصحا--به من اراد الحياة التي -ليس بعدها م---وت -و--الراحة ا---ل---تي ليس بعدها ----نصب والسر--ور ال---ذي ليس -بعده حزن فليتقرب- ا-لي -الله بقتال- هءل---اء المحلين ا--لرواح -الي ا-لجنة -وذلك -ع-ند ا	ما عاهدوا الله عليه فمنهم من قضي نحبه ومنهم من ينتظر وما بدلوا تبديلا الاحزاب وقا-ل -جل -جلاله يا ايها الذين امنوا اوفوا بالعقود الماءدة وقال ولا تنقضوا- الايمان بعد توكيدها وقد جعلتم الله عليكم كفيلا ان الله يعلم ما تفعلون ولا تكونوا كالتي نقضت غزلها من بعد قوة انكاثا النحل وقال لقد اخذنا ميثاق بني اسراءيل الماءدة ومن امثال هذا فقد اخبر الله تعالي انه لم يملك حقه الا لمن اخذ عهده فاعطنا صفقة يمينك وعاهدنا	1442	889	-8635307649939781291	4351369384646950528	127	409	43.520782470703125	13	0845Maqrizi.Muqaffa.Sham19Y0145334-ara1.completed	0845Maqrizi.Mawaciz.Shamela0011566-ara1.mARkdown
1361	843	1494	986	-8020384904724402078	-6636270028460100563	0845Maqrizi.Muqaffa.Sham19Y0145334-ara1.completed.ms1508	0845Maqrizi.Mawaciz.Shamela0011566-ara1.mARkdown.ms2076	126	--ا- -حقير فاتقي جانبه الخاص والعام حتي الامير بدر الدين بيليك الخ-زندار ناءب السلطنة والصاحب بهاء الدين علي بن حنا وملوك الاطراف و--ملوك-- ال-	سماه الخضر فاتقي جانبه الخاص والعام حتي الامير بدر الدين بيلبك الخازندار ناءب السلطنة والصاحب بهاء الدين علي بن حنا وملوك الاطراف وكان يكتب الي	1508	2076	-9141605347961066163	-7218447993914055085	103	143	88.11188507080078	18	0845Maqrizi.Muqaffa.Sham19Y0145334-ara1.completed	0845Maqrizi.Mawaciz.Shamela0011566-ara1.mARkdown
1099	45	1505	585	-8020384904724402078	-6636270028460100563	0845Maqrizi.Muqaffa.Sham19Y0145334-ara1.completed.ms0220	0845Maqrizi.Mawaciz.Shamela0011566-ara1.mARkdown.ms2102	239	ال-صلاح ---والديا--ن--ة ول--ه -نظم ونثر ----وكان -ا-عمي توفي --سنة --ست- وثم-انين --و-ستماءة الشريف اب-و ال-عباس-- القناءي احمد بن -ا-ب-را---هيم بن الحسن ابن ال-شيخ عبد-- الرحي-م ---ا-----بن ا---حمد بن جحون بن محمد بن -حمزة بن جعفر ب--ن ا---سم-اعيل بن جعفر بن محمد ----بن ال---حسي-----ن بن- عل---ي بن محمد بن جعفر الصادق بن محمد الباقر بن علي زين العابدين بن الحسين بن علي بن ابي طالب ---------ا--لشريف ----اب-و-- ال----عباس القناءي -المصري الشا--فعي- --ام--ه ---ا---بن----ة ال-شيخ -ابي حسن ال---شا--ذل-----ي -كا---ن- يرعي ا--لغنم- ا-ل-ي --ان ب-	الاسلام شرف الانام ناصر الدين خليل امير المءمنين زاد الله في علاءه وامتع المءمنين بطول بقاءه في شهر ربيع الاخر سنة ا-ثنتين وثمانين واربعماءة والقبة ال-تي علي الضريح جددها الخليفة الحافظ لدين الله في سنة اثنتين وثلاثين وخمسماءة وامر بعمل الرخام الذي ب-المحراب- مشهد السيدة كلثوم هي كلثوم بنت القاسم بن محمد بن جعفر الصادق بن محمد الباقر بن علي زين العابدين بن الحسين بن علي بن ابي طالب موضعه بمقابر قريش بمصر بجوار الخندق وهي ام جعفر بن موسي بن اسماعيل بن موسي الكاظم بن جعفر الصادق كانت -من الزاهدات العابدات سنا وثنا يقال انهما من اولاد جعفر بن	220	2102	-4203179388461932707	-646992320619901490	167	545	43.85321044921875	19	0845Maqrizi.Muqaffa.Sham19Y0145334-ara1.completed	0845Maqrizi.Mawaciz.Shamela0011566-ara1.mARkdown
4	580	621	1382	-8020384904724402078	-6636270028460100563	0845Maqrizi.Muqaffa.Sham19Y0145334-ara1.completed.ms0300	0845Maqrizi.Mawaciz.Shamela0011566-ara1.mARkdown.ms0723	388	-ا-ءع-- ال--ذي فيه الحديدة والكف الذي فيه- الخاتم فقال له يا هذا كل من مد يده اليك فاعطه فهذه هي ا-لطبقة المستور-ة التي ذكرها الل-------ه -------في كتابه فقال يحسبهم الجاهل اغنياء من التعفف البقرة فاحذر ان ترد يدا امتدت اليك واعط كل من يطلب منك ----وبات ليلة في -------ق---بة -الهوا--ء خ-ا-لي--ا--- ---مفكر-ا--- فقال -له سوا-ر الخاد-م --قد مضي -اكثر --ال-ليل ومولاي منتصب فلو ا-عطي نفسه ح--ظها -من ال--ر--احة -كان ذل--ك ا--عود عل-يه قال -------يا-- -بني -ا---نا--- كل-فنا من القيام بامر --هذه --ال-بلدة ما كلف--ن-ا--ه فان نحن ا-عطينا ان-فسنا---- حظها -من ال-----ن-و--م --والرا--حة ---واهم-لنا ----ال-فكر في تدبير ا--ح---والها والشغل -----ب----ما- -يعود -به- صل-اح ا-م-ور-ها وصيانة -اهلها لم يا-م---نوا في سربهم-- لكن--ي اري --ا-ن --اتعب و--ينام-وا ---ا--صلح م-------ن -ا-ن ا--ستريح و-يخافوا -وكان يقول -لم---ن --ي	والمعصم الراءع فيه الحديدة والكف -----فيها الخاتم فقال--- يا هذا كل من مد يده اليك فاعطه فهذه هي اللطيفة المستوردة التي ذكرها الله سبحانه وتعالي في كتابه فقال يحسبهم الجاهل اغنياء من التعفف البقرة فاحذر ان ترد يدا امتدت اليك واعط كل من يطلب منك فلما مات احمد بن طولون وقام من بعده ابنه خمارويه اقبل علي قصر ابيه وزاد فيه -واخذ الميدان الذي كان لابيه فجعله كله بستانا وزرع فيه انواع الرياحين واصناف الشجر ونقل اليه الودي اللطيف الذي ينال ثمره القاءم ومنه ما يتناوله الجالس من ا-صناف خيار النخل وحمل اليه كل صنف من الشجر المطعم العجيب وانواع الورد وزرع فيه الزعفران وكسا اجسام النخل نحاسا مذهبا حسن الصنعة وجعل بين النحاس واجساد النخل مزاريب الرصاص واجري فيها الماء المدبر فكان يخرج من تضاعيف قاءم النخل عيون الماء فتنحدر الي فساقي معمولة ويفيض منها الماء الي مجار تسقي ساءر البست-ان وغرس فيه من الريحان المزروع علي	300	723	8113067284841222688	-8520301248106928986	282	813	47.7244758605957	37	0845Maqrizi.Muqaffa.Sham19Y0145334-ara1.completed	0845Maqrizi.Mawaciz.Shamela0011566-ara1.mARkdown
399	81	657	444	-8020384904724402078	-6636270028460100563	0845Maqrizi.Muqaffa.Sham19Y0145334-ara1.completed.ms1963	0845Maqrizi.Mawaciz.Shamela0011566-ara1.mARkdown.ms1406	164	-النطرون والخراج وما معه من ثمن القرظ وساحل السنط والمراكب الديوانية و--نا--حيت-ي -اسني و--------طنبذي-- فاستخدم ال---عا---دل-- ----ف-ي -مباشرة -ديوان ال-اسطول صفي الدين هذا -فاشت-هر -م-ن حينءذ -ذكر-ه وتخصص -ب----الملك -----ال-عا---دل-- ---اكثاره- -----من الم-------صا-د-رات --فلما-- قدر الله -ت---عالي ---با--ن ال--ملك --الع-ا---دل م---لك--- ---ديا-ر -مصر-- -في سن-ة	والنطرون والخراج وما معه من ثمن القرظ وساحل السنط والمراكب الديوانية واشنا وطنتدي واحيل ورثة امير الجيوش علي غير الحبس الذي لهم ثم افتي الفقهاء ببطلان الحبس و-قبضت ال--نواحي وصارت من جملة اموال الخراج فعرفت ببلاد الملك وهذه الضواحي الان منها ما هو وقف ومنها ما هو في الديوان السلطاني وخر-اجها يتميز علي غيرها من النواحي ويزرع اكثرها من الكتان والمقاثي وغيرها ذكر منية	1963	1406	-7621984988351677004	-9113410824845513784	124	367	44.686649322509766	10	0845Maqrizi.Muqaffa.Sham19Y0145334-ara1.completed	0845Maqrizi.Mawaciz.Shamela0011566-ara1.mARkdown
20	631	807	1528	-8020384904724402078	-6636270028460100563	0845Maqrizi.Muqaffa.Sham19Y0145334-ara1.completed.ms2667	0845Maqrizi.Mawaciz.Shamela0011566-ara1.mARkdown.ms1794	386	و--- عبد ال--ل--ه ابن- -ال-وزي----ر ----الصا-----حب ---ب-ه-----اء --ال---دين -----ابن القا-ضي --السديد ابي ---عبد -الله ا---بن -ا--بي ال--فرج و-----لد بمصر سنة -اثنتين و--عشرين --وستماءة --سمع --بالقاهرة م-ن -ابي -الحسن- ----بن المقير و--غيره وبد--مشق ---من ---ا-ب---ي ال----ع--------باس --احمد بن عبد ال-دا---ءم- ---وغي-ره وح-د--ث ---كتب- عنه ابو ----محمد الدمي-----اطي ودرس ال---فقه عل--ي- --مذهب --الشافعي- بمد---رس-ة -------و-الده --بم-صر ---وناب عن- --حميه الصاحب شرف الدين هبة الله بن صاعد الفاءزي -----في -ال--------وزارة -وعن --و---ال---ده ---ا-لصا--حب- ---بهاء ال-----دي--ن ---ع--ل--ي- ب------ن --م----حمد -بن ---سليم وولي --د--يوا--ن ال-احباس وكان -وزير ال---صحبة في الايام الظاهرية بيبرس وكان محبا لاهل الخير والصلاح مءثرا لهم متفقدا لاحوالهم وعمر رباطا حسنا بقرافة مصر يشرف علي بركة الحبش ورتب فيه جماعة من الفقراء وتوفي بمصر يوم الاثنين حادي عشرين شعبان سنة ثمان وستين وستماءة ودفن من الغد قريبا من الفخر الفارسي بالقرافة واتفق له ما فيه معتبر وذكري وهو ان الصاحب زين الدين يعقوب بن عبد الرفيع بن الزبير مات في ثا-	وكان ماء النيل في زمنه يصل الي جدار هذا الجامع وولي خطابته للفقيه جمال الدين محمد ابن الماشطة ومنعه من لبس السواد لاداء الخطبة فاستمر الي حين وفاته في عاشر رجب سنة تسع وسبعماءة واول خطبة اقيمت فيه يوم الجمعة سابع صفر سنة اثنتين وسبعين وستماءة وقد ذكرت ترجمة الصاحب تاج الدين عند ذكر رباط الاثار من هذا الكتاب محمد بن علي بن محمد بن سليم بن حنا ابو عبد الله الوزير الصاحب فخر- الدين بن الوزير الصاحب بهاء الدين ولد في سنة اثنتين وعشرين وستماءة وتزوج بابنة الوزير الصاحب شرف الدين هبة الله بن صاعد الفاءزي وناب عن والده في الوزارة وولي ديوان الاحباس ووزارة الصحبة في ايام الظاهر بيبرس وسمع الحديث بالقاهرة ودمشق وحدث وله شعر جيد ودرس بمدرسة ابيه الصاحب-- بهاء الدين التي كانت في --زقاق القناديل بمصر- وكان محبا لاهل الخير والصلاح مءثرا لهم متفقدا لاحوالهم وعمر رباطا حسنا بالقرافة الكبري رتب فيه جماعة من الفقراء ومن غريب ما يتعظ به الاريب ان الوزير --------------------------------------------------------------------------------------------------------------------------الصاحب زين الدين يعقوب بن عبد الرفيع بن الزبير -ا-لذي كان	2667	1794	8245440681555188770	7183068433359790998	276	1027	37.585201263427734	31	0845Maqrizi.Muqaffa.Sham19Y0145334-ara1.completed	0845Maqrizi.Mawaciz.Shamela0011566-ara1.mARkdown
138	915	665	1480	-8020384904724402078	-6636270028460100563	0845Maqrizi.Muqaffa.Sham19Y0145334-ara1.completed.ms0273	0845Maqrizi.Mawaciz.Shamela0011566-ara1.mARkdown.ms0718	304	-ه --عليه-ا فقيل له ان احمد -بن طولون --ا-لثقة الامين -ا-لخير -الد---------ين فقل-------ده- خل--ا-فته علي --م--صر -و-ضم -اليه ال-جيش و---بعثه --------فدخل- مصر -------يوم ال--خميس لسبع بقين من---- رمضان سنة اربع وخمسين وماءتين م-قلدا للقصبة دون غيرها من الاعمال الخارجة عنها كالاسكندرية ونحوها وعمره اربع وثلاثون سنة ويوم واحد فلما جلس الناس لمشاهدة دخوله وفيهم الاعمي غلام ابي قبيل صاحب الملاحم ساله رجل عما يجده في كتبهم عن احمد بن طولون فقال هذا رجل نجد صفته كذا وكذا وانه يتقلد البلد هو وولده قريبا من اربعين سنة فما تم كلامه حتي اقبل احمد بن طولون با-لصفة التي -وصفه -بها -ال-اعمي --لم يغادر من	له فتسلمه منه وقتله -وواراه ابن طولون وعاد الي سر م-ن راي وقد تقلد باكباك مصر وطلب من يوجهه اليها فذكر له احمد بن طولون فقلده خلافته وضم اليه جيشا وسار الي مصر فدخلها يوم الاربعاء لسبع بقين من شهر رمضان سنة اربع وخمسين وماءتين متقلدا للقصبة دون غيرها من الاعمال الخارجة عنها كالاسكندرية ونحوها ودخل معه احمد بن محمد الواسطي وجلس الناس لرءيته فسال بعضهم غلام ابي قبيل صاحب الملاحم وكان مكفوفا عما يجده في كتبهم ------------------------------فقال هذا رجل نجد صفته كذا وكذا وانه يتقلد الملك هو وولده قريبا من اربعين سنة فما تم كلامه حتي اقبل احمد بن طولون واذا هو عل-ي النعت الذي قال ولما تسلم احمد- بن	273	718	2220179848275875589	3126719588594396333	231	599	50.751251220703125	42	0845Maqrizi.Muqaffa.Sham19Y0145334-ara1.completed	0845Maqrizi.Mawaciz.Shamela0011566-ara1.mARkdown
1046	26	1458	455	-8020384904724402078	-6636270028460100563	0845Maqrizi.Muqaffa.Sham19Y0145334-ara1.completed.ms0962	0845Maqrizi.Mawaciz.Shamela0011566-ara1.mARkdown.ms1033	342	م--قورا و- البس------ا---------ه-- فلما قطعوا ---بعض الطريق اراد الاستاذان ان يكمل- ال--اجر بزعمهما فقالا للحمالين هو رجل تربيت ه عندنا فنادوا عليه نداء الرجال واكتموا الحال وهذه اربعة دنانير لكم فسر الحمالون بذلك ودفنوه ثم عادوا الي صاحب الدكان وعرفوه بما جري وقاسموه الدنانير فخاف علي نفسه وعلم ان هذا الامر لا يخفي فمضي بالحمالين الي الوالي وذكر له الق-صة فاودعهم ---ال---سجن واخذ الذهب منهم وكتب مطالعة -الي الاف----ضل فاخذها القاءد ابو عبد الله --	مع التابوت الاستاذان المشار اليهما فلما قطعوا به بعض الطريق اراد---ا تكميل الاجر له علي قدر عقولهما فقالا للحمالين هو رجل تربيت-ه عندنا فنادوا عليه نداء الرجال واكتموا الحال وهذه اربعة دنانير لكم فسر الحمالون بذلك --ف---لما عادوا الي صاحب الدكان -عرفوه بما جري وقاسموه الدنانير فخاف---ت نفسه وعلم ان-ه-ا -قضية لا تخفي فمضي ب--هم---- الي الوالي وشرح له القضية فاودعهم في الاعتقال واخذ الذهب منهم وكتب مطالعة بال-حال فمن اول ما سمع القاءد ابو عبد الله بن	962	1033	-8920137173141283369	682715630751491623	276	452	75.6637191772461	51	0845Maqrizi.Muqaffa.Sham19Y0145334-ara1.completed	0845Maqrizi.Mawaciz.Shamela0011566-ara1.mARkdown
1	1090	720	1456	-8020384904724402078	-6636270028460100563	0845Maqrizi.Muqaffa.Sham19Y0145334-ara1.completed.ms1022	0845Maqrizi.Mawaciz.Shamela0011566-ara1.mARkdown.ms0061	354	الرحمن الرحيم من محمد رسول الله الي المقوقس عظيم القبط سلام علي من اتبع الهدي اما بعد فاني ادعوك بدعاية الاسلام -اسلم تسلم يءتك الله اجرك مرتين -يا اهل الكتاب تعالوا الي كلمة سواء بيننا وبينكم ا--لا نعبد الا الله ولا نشرك به شيءا ولا يتخذ بعضنا بعضا اربابا من دون الله فان تولوا فقولوا اشهدوا بانا مسلمون ال عمران وقيل بل كان في الكتاب بعد البسملة اما بعد فان الله ارسلني رسولا وانزل علي قرانا مبينا وامرني بالاعذار والانذار ومقاتلة الكفار حتي يدينوا بديني ويدخلوا في ملتي وقد دعوتك الي الاقرار بالوحدانية لله الواحد الاحد واني رسول الله فان انت اجبت فقد سعدت وان ابيت فقد شقيت والسلام علي من اتبع الهدي ويا اهل الكتاب تعالوا ب الي كلمة سواء بيننا وبينكم الاية فلما قراه اخذه فجعله في حق من عاج وختم عليه وانزل حاطب بن -ابي	الرحمن الرحيم من محمد رسول الله الي المقوقس عظيم القبط سلام علي من اتبع الهدي اما بعد فاني ادعوك بدعاية الاسلام فاسلم تسلم يءتك الله اجرك مرتين ويا اهل الكتاب تعالوا الي كلمة سواء بيننا وبينكم ان لا نعبد الا الله ولا نشرك به شيءا ولا يتخذ بعضنا بعضا اربابا من دون الله فان تولوا فقولوا اشهدوا بانا مسلمون --------------------------------------------------------------------------------------------------------------------------------------------------------------------------------------------------------------------------------------------------------------------------------------------------------------------------------------------------------------------فلما قراه اخذه فجعله في حق من عاج وختم عليه وعن -ابا-ن بن صالح	1022	61	-6255231619387610357	-2188636051622936483	283	724	48.89502716064453	66	0845Maqrizi.Muqaffa.Sham19Y0145334-ara1.completed	0845Maqrizi.Mawaciz.Shamela0011566-ara1.mARkdown
