begin	begin2	end	end2	gid	gid2	id	id2	matches	s1	s2	seq	seq2	uid	uid2	ch_match	align_len	matches_percentage	w_match	series_b1	series_b2
1	1075	275	1452	-8020384904724402078	-6636270028460100563	0845Maqrizi.Muqaffa.Sham19Y0145334-ara1.completed.ms1400	0845Maqrizi.Mawaciz.Shamela0011566-ara1.mARkdown.ms0964	196	الناس اما وابا وخيرهم اذ ينسبون نسبا -فلم يعطه ----ابن --زياد -شي--ءا- وروي --حماد -بن ------سلمة ---ثنا ع---ما--ر بن -----ابي --عما-ر ان -ابن ------ع----ب------------ا----------------------------------------------س رضي الله عنه قال رايت النبي صلي الله عليه وسلم فيما يري الناءم ذات يوم نصف النها-ر اشعث اغبر بيده قارورة فيها دم فقلت يا نبي الله بابي انت وامي ما- هذه --قال هذا دم ا-ل	الناس اما وابا وخيرهم اذ ينسبون نسبا وقيل قتله عمرو بن سعد بن ابي وقاص وكان الامير علي الخيل التي اخرجها عبيد الله بن زياد الي قتل الحسين وامر عليهم عمرو بن سعد ووعده ان يوليه الري ان ظفر بالحسين وقتله وقال ابن عباس رضي الله عنه-ما- رايت النبي صلي الله عليه وسلم فيما يري الناءم نصف النهار وهو قاءم اشعث اغبر بيده قارورة فيها دم فقلت با--بي ا-نت وامي -ما -هذا قال هذا دم الحسين لم ازل	1400	964	-5429551108715325545	5535510924990095602	143	384	51.04166793823242	27	0845Maqrizi.Muqaffa.Sham19Y0145334-ara1.completed	0845Maqrizi.Mawaciz.Shamela0011566-ara1.mARkdown
292	65	779	726	-8020384904724402078	-6636270028460100563	0845Maqrizi.Muqaffa.Sham19Y0145334-ara1.completed.ms1088	0845Maqrizi.Mawaciz.Shamela0011566-ara1.mARkdown.ms1658	291	-لوه- --ترب-ة --ا--قسن--قر وذبحوه ---------ذبحا في يوم الاحد ثاني عشر رمضان سنة ثمان ب واربعين وسبعماءة فكانت مدته سنة وثلاثة اشهر واثني عشر يوما واقي--م- بعده --في السلطنة ا-خوه الناصر ------حسن -بن --م-----حمد بن -قلاوون ابو ال-قا-سم -ا--لفهري ----ا ا---لحارث بن- الابي----ض بن الا--سود بن نافع بن ابي --عبي-دة بن --عقبة --بن --نافع ال---فهري -ا---بو ال-قاس--------م -راي- -----ع-بد --ا----ل--له بن- ---وهب و-روي- --عن زيد-- --بن -بشر توفي بم----صر --في -جما--دي الاخرة سنة ست وسبعين وم---اءت---ين بعد ما اس-ن ا---بو---- ------الا-سد الهمداني ا---- الحارث --بن اسد بن معقل --الهم--دا-ني- ا---بو- ----الاسد يروي عن -بشر بن ---بكر و-غيره -روي ع-نه ال--نسا--ءي-- و-ا-	اليهم وحاربهم فخانه من معه وتركوه حتي اخذ وذبح- في يوم الاحد ثاني عشر رمضان سنة ثمان --واربعين وسبعماءة وكانت مدته سنة وثلاثة اشهر واثني عشر يوما واقيم من بعده اخوه السلطان الملك الناصر بدر الدين ابو المعالي حسن بن محمد في يوم الثلاثاء رابع عشرة وعمره احدي عشرة سنة فلم يكن له من الامر شء والقاءم بالامر الامير شيخو العمري فلما اخذ في الاستبداد بالتصرف خلع وسجن في يوم اثنين ثامن عشري جمادي الاخرة سنة اثنتين وخمسين فكانت مدته اربع سنين تنقص خمسة عشر يوما منها تحت الحجر ثلاث سنين ونيف ومدة استبداده نحو من تسعة اشهر واقيم من بعده اخوه السلطان- الملك الصالح صلاح الد-ين صالح في يوم الاثنين المذكور فكثر لهوه وخرج عن الحد في التبذل واللعب فثار عليه الاميران شيخو وطاز	1088	1658	8506320824634223869	-1784317392263101664	200	666	43.693695068359375	21	0845Maqrizi.Muqaffa.Sham19Y0145334-ara1.completed	0845Maqrizi.Mawaciz.Shamela0011566-ara1.mARkdown
110	541	1101	1493	-8020384904724402078	-6636270028460100563	0845Maqrizi.Muqaffa.Sham19Y0145334-ara1.completed.ms0340	0845Maqrizi.Mawaciz.Shamela0011566-ara1.mARkdown.ms1089	262	اء بعدة مداءح وكان الافضل شاهنشاه ابن امير الجيوش اذا اعتني باحد كتب معه الي ابن حديد هذا فيبالغ في الافضال عليه حتي يبلغ منه فوق ما يءمله وكان له بستان بظاهر الثغر يتفرج فيه وله به جرن كبير من رخام قطعة واحدة ينحدر --------------------------------------------------------فيه الماء فيبقي كالبركة من كبره وسعته وكان يجد في نفسه برودة هذا الجرن زيادة ترف علي من سواه من اهل عصره ويسامي بذلك الاكابر فوشي به الي الغالية البدوية محبوبة الخليفة الامر باحكام الله ابي علي المنصور فطلبته من الامر فانفذ اليه باحضار الجرن فلم يسعه الا ان قلعه من مكانه وحمله الي مصر فعمله الامر في الهودج الذي بناه للبدوية في الجزيرة التي تعرف بالروضة تجاه مدينة مصر فبقي في قلب المكين حزازة لاخذ هذا الجرن وراي ان قد اتضع بذلك فبذل جهده في خدمة الغالية وجميع من يلوذ بها حتي قالت لعظم ما حمله اليها هذا الرجل قد اخجلنا بكثرة هداياه وتحفه ولم يكلفنا قط امرا نقدر عليه عند ا الخليفة مولانا ف----قال ل---ما بل-غه عنها ذلك ما لي حاجة بعد الدعاء لله بحفظ مكانها وطول حياتها غي--ر ر-د ال--جرن الذي قلع- من داري التي بنيتها في ايامهم من نعمتهم ----الي موضعه- ف-عجبت الغالية من ذلك وردته- عليه ف-اعاده	الحي بثلاثة ابيات وكان بالاسكندرية مكين الدولة ابو طالب احمد بن عبد المجيد بن احمد بن الحسن بن حديد له مروءة عظيمة ويحتذي افعال البرامكة وللشعراء فيه امداح كثيرة مدحه ظافر الحداد وامية بن ابي الصلت وغيرهما وكان له بستان يتفرج فيه به جرن كبير من رخام وهو قطعة واحدة وينحدر فيه الماء فيبقي كالبركة من كبره وكان يجد في نفسه برءيته زيادة علي اهل التنعم والمباهاة في عصره فوشي به للبدوية محبوبة الامر فسالت الخليفة الامر في حمل الجرن اليها فارسل الي ابن حديد باحضار الجرن فلم يجد بدا من حمله من البستان فلما صار الي الامر امر بعمله في الهودج فقلق ابن حديد وصارت في قلبه حرارة من اخذ الجرن فاخذ يخدم البدوية ومن يلوذ بها بانواع الخدم العظيمة الخارجة عن الحد في الكثرة حتي قالت البدوية هذا الرجل اخجلنا بكثرة تحفه -----------------------------------------------------------------------------------------------------------ولم يكلفنا قط امرا نقدر عليه عند-- الخليفة مولانا فلما قيل له هذا القول عنها قال ما لي حاجة بعد الدعاء لله بحفظ مكانها وطول حياتها في عز ردد الفسقية التي قلعت من داري التي بنيتها في ايامها من نعمتهم ترد الي مكانها فتعجبت --------من ذلك وردتها عليه فقيل له	340	1089	-4575729460788707797	5631290253567149906	201	1069	24.508886337280273	35	0845Maqrizi.Muqaffa.Sham19Y0145334-ara1.completed	0845Maqrizi.Mawaciz.Shamela0011566-ara1.mARkdown
1	1070	481	1719	-8020384904724402078	-6636270028460100563	0845Maqrizi.Muqaffa.Sham19Y0145334-ara1.completed.ms0471	0845Maqrizi.Mawaciz.Shamela0011566-ara1.mARkdown.ms1800	296	-الله -صلي-- ال-له- علي---------ه وسلم -----والامر بالمعروف والنهي عن المنكر والجهاد في سبيل الله واخذ اموال الله بحقها وصرفها في مستحقها ونعته بامير ال--مءمنين المستنصر بالله ا-بي القاسم و وال-شيخ -عز ا--ل-د--------ين عبد -------ا-ل--عزي----ز بن -عبد ال-----سلا-م فلما- -تم-ت--- ----مب-ا-----يعة ال--سل-ط-ان للخ---ل-يفة -----ق-لد الخليفة -ا--لامام المستنصر بالله ال---ملك --الظاهر -ا-م--و--ر البلاد ال-اسلامية -وما -ين-ضاف ال----يها-- بما -سيفتحه ال-ل--ه -عل--ي يديه من البل-----اد ا--ل----تي بيد ال-----كفا-ر -وجلس ال-سلطان ---فقام -ال--ناس عل--ي- -قدر مراتبهم وباي---ع---وا---- الخليفة و--احدا بعد-- و--احد ---وكتب -عند انقضاء -ال--ب-ي-عة في -ال--مجلس-	بالله وبايعه الظاهر علي كتاب الله وسنة نبيه والامر بالمعروف والنهي عن المنكر والجهاد في سبيل الله واخذ اموال الله بحقها وصرفهاف ي مستحقها -فلما -تم-ت البيعة قلد المستنصر بالله السلطان الملك -الظاهر امر البلاد الاسلامية وما سيفتحه الله علي يديه من بلاد الكفار وبايع الناس المستنصر علي طبقاتهم وكتب الي الاطراف باخذ البيعة له واقامة الخ-طبة باسمه علي الم-نابر ونقشت السكة في ديار مصر باسمه واسم المل-ك الظاهر معا فلما كان يوم الجمعة سابع عشر رجب خطب الخليفة بالناس في جامع القلعة وركب السلطان في يوم الاثنين رابع شعبان الي خيمة ضربت له بالبستان الكبير ظاهر القاهرة وافيضت عليه الخلع الخليفة وهي جبة سوداء وعمامة بنفسجية وطوق من ذهب وقلد بسيف عربي وجلس مجلسا	471	1800	9174273244253565455	-5590839624263103731	218	656	45.121952056884766	17	0845Maqrizi.Muqaffa.Sham19Y0145334-ara1.completed	0845Maqrizi.Mawaciz.Shamela0011566-ara1.mARkdown
6	1052	349	1484	-8020384904724402078	-6636270028460100563	0845Maqrizi.Muqaffa.Sham19Y0145334-ara1.completed.ms1401	0845Maqrizi.Mawaciz.Shamela0011566-ara1.mARkdown.ms0964	229	ا--ل- ا----ب-----و عمر -بن-- عبد البر ---انم-ا- -نسب -قتل الحسين -الي عمر- بن سعد --لا-----نه -كان الامير علي الخيل التي -جهزها عبيد الله بن زياد الي قتل الحسين وامر عليهم عمر- بن سعد ووعده ان يوليه الري ان ظفر بالحسين وقتله و---كا-ن --في تلك الخيل قوم- --من --مضر ومن ا-ل---يمن و-في -شعر سليما-ن بن قتة الخزا-عي و-ق-يل ا--نها -لابي-- -ا-لر--مي----ح -ال-خزاعي ----ما ي-دل علي -ال---ا-شتراك في- دم ا-ل--حسين فمن- ذل--ك قو--له الطويل	الملك المحجبا قتلت خير الناس اما وابا وخيرهم اذ ينسبون نسبا وقيل قتله عمرو بن سعد بن ابي وقاص وكان الامير علي الخيل التي اخرجها عبيد الله بن زياد الي قتل الحسين وامر عليهم عمرو بن سعد ووعده ان يوليه الري ان ظفر بالحسين وقتله وقال ابن عباس رضي الله عنهما رايت النبي صلي الله عليه وسلم فيما يري الناءم نصف النهار وهو قاءم اشعث اغبر بيده قارورة فيها دم فقلت بابي انت وامي ما هذا قال هذا دم الحسين لم ازل التقطه منذ اليوم فوجدته قد قتل	1401	964	8334943053037534097	5535510924990095602	166	432	53.00925827026367	25	0845Maqrizi.Muqaffa.Sham19Y0145334-ara1.completed	0845Maqrizi.Mawaciz.Shamela0011566-ara1.mARkdown
1239	648	1454	906	-8020384904724402078	-6636270028460100563	0845Maqrizi.Muqaffa.Sham19Y0145334-ara1.completed.ms0271	0845Maqrizi.Mawaciz.Shamela0011566-ara1.mARkdown.ms0717	136	-ولاه ال-ام-ر من بعده شجاعة -ابن طولون و---كا---ن قد نشا --ن-شوءا-- جمي-لا-- ------وطلب الحديث واحب الغزو وخرج الي طرسوس مرات ولقي الشيوخ المحدثين وسمع منهم وكتب العلم و-ح--صل---- --من ذل--ك -قطعة --كبيرة وصحب هناك -جماعة من- ال--زهاد و----اهل- ال--دين و-الورع فتاد	اولاد العجم فوصف بعلو الهمة وحسن الادب والذهاب بنفسه عما كان يترامي اليه اهل طبقته وطلب الحديث واحب الغزو وخرج الي طرسوس مرات ولقي -------المحدثين وسمع منهم وكتب العلم وصحب الزهاد واهل الورع فتادب بادابهم وظهر فضله فاشتهر عند الاولياء وتميز علي الاتراك وصار في عداد	271	717	1361199216453602623	3558599652084331688	99	265	51.32075500488281	13	0845Maqrizi.Muqaffa.Sham19Y0145334-ara1.completed	0845Maqrizi.Mawaciz.Shamela0011566-ara1.mARkdown
1019	731	1602	1045	-8020384904724402078	-6636270028460100563	0845Maqrizi.Muqaffa.Sham19Y0145334-ara1.completed.ms0339	0845Maqrizi.Mawaciz.Shamela0011566-ara1.mARkdown.ms1524	151	-ي --قضاء --ا--دفو واسوا---ن -----وال-اقصر وكان حسن السيرة --م---رتضي -في-- ا-ف--------ع-----اله--- وما----ت با-سوا-ن-- ---بعد -سنة ثمان-ين وس-تماءة القاضي المكين ابو طالب ابن حديد احمد بن عبد المجيد بن احمد بن الحسن بن حديد بن حمدون الكناني القاضي مكين الدولة وامينها ابو طالب ابن القاضي ابي ولد في سنة اثنتين وستين واربعماءة وولي قضاء الاسكندرية بعد ابيه في واضيف اليه مشارف الثغر التي تعرف اليوم بنظر الاسكندرية فباشر ذلك الي ان توفي في ثغر رشيد وهو عاءد من القاهرة الي الاسكندرية في يوم جمادي الاخرة سنة ثمان وعشرين وخمسماءة ورثي بقصاءد كثيرة وكان قد استولي علي ساءر امور الاسكندرية ولم يبق لاحد معه فيها كلام وضمنها للدولة بجملة -ام-وا	في الفضاء ولا تقبض نفسها تحت حيطان المدينة فبني لها البناء المشهور في جزيرة الفسطاط المعروف بالهودج وكان علي شاطء النيل في شكل غريب وكان بالاسكندرية القاضي --مكين ا--لدولة ابو طالب احمد بن عبد المجيد بن احمد بن الحسن بن حديد قد استولي علي امورها وصار قاضيها وناظرها ---------------------------------------------------------------------------------------------------------------------------------------------------------------------------------------------------------------------------------------------------------------------------------------------------------------------------------ولم يبق لاحد معه فيها كلام وضمن ا-موالها بحملة يحملها	339	1524	-8694946928602662449	-4959998346500297882	111	640	23.59375	17	0845Maqrizi.Muqaffa.Sham19Y0145334-ara1.completed	0845Maqrizi.Mawaciz.Shamela0011566-ara1.mARkdown
1168	1	1579	530	-8020384904724402078	-6636270028460100563	0845Maqrizi.Muqaffa.Sham19Y0145334-ara1.completed.ms0274	0845Maqrizi.Mawaciz.Shamela0011566-ara1.mARkdown.ms0731	200	ر--ع ا-حمد بن- --طو--لون ف--ي ب---نا-ء --ا-لميدا---ن في شعبان وكا-ن ف--ي موضعه -قبو-ر الي--هو-د --وا---لنصاري فامر ب----ها فخربت -وب-ني مكانها --وقدم عليه اب------نا---ه ال-عباس و------------خمارويه -من- --م--كة اول-- سنة سبع--- ---وستي-------ن- ----و--ورد عليه كتاب يارجوخ بتسل----م---------- الاعمال الخارجة عن يده من ارض مصر فتسلم الاسكندرية من اسحاق بن دينار وخرج اليها لثمان خلون من رمضان فاستخلف علي الفسطاط كيغلغ ثم قدم من الاسكندرية لاربع عشرة بقيت من شوال وخرج اليها ----------------ثانيا لثمان بقين من شعبان سنة تسع وخمسين	ربيع الاول سنة ست وخمسين فبعث بجيش اخر فواقعه باخميم في -ربيع الاخر فانهزم ابن الصوفي الي الواح فاقام به وخرج احمد بن طولون يريد حرب عيسي بن الشيخ ثم عاد فابتدا في ابناء الميدان وقدم العباس وخمارويه ابنا احمد بن طولون من- العراق علي طريق مكة سنة سبع وخمسين وورد كتاب ما-جور بتسلم احمد بن طولون الاعمال الخارجة عن يده من ارض مصر فتسلم الاسكندرية وخرج اليها لثمان خلون من شهر رمضان واستخلف طفج صاحب الشرط ثم قدم لاربع عشرة بقيت من شوال وسخط علي اخيه موسي وامره بلباس البياض وخرج الي الاسكندرية ثانيا لثمان بقين من شعبان سنة تسع وخمسين	274	731	546546593751934070	1821092876333070224	148	532	37.59398651123047	18	0845Maqrizi.Muqaffa.Sham19Y0145334-ara1.completed	0845Maqrizi.Mawaciz.Shamela0011566-ara1.mARkdown
37	28	694	871	-8020384904724402078	-6636270028460100563	0845Maqrizi.Muqaffa.Sham19Y0145334-ara1.completed.ms1852	0845Maqrizi.Mawaciz.Shamela0011566-ara1.mARkdown.ms0702	336	حب من الموالي وعبد الله اول من خطب في السواد بمصر وخرج الي ابي جعفر المنصور لعشر بقين من شهر -----------------------رمضان سنة اربع وخمسين وماءة واستخلف اخاه محمدا ورجع في اخر السنة وتوفي وهو وال يوم الاحد مستهل صفر سنة خمس وخمسين وماءة واستخلف اخاه محمدا فكانت ولايته مصر سنتين وشهرين رو-ي ----عنه ع----مر--و بن -------ب--حري- -ا---ل-سباءي- ----و -لم يذكر---ه البخاري ولا- ابن -ابي حاتم في كتابيهما-- ول-ي-س بم------شهور عن--د -ا--هل الحدي------ث والمشهو-ر --اخوه ---عب-د -ا---ل--واح-د بن -عبد -الر--حمن ----قاضي -مص--ر ---جمال--- الدين --ابن عبد الغني ا عب-د الله- بن عبد الغن-ي--- -بن ---عبد ----الو-احد بن علي ب-ن سرور جمال ال-دين -ابو موسي -ابن الحافظ ا-----بي--- ----محم---د ال-مقد-سي ال-ا-صل ال----دمشقي--- الدار ال-حنبلي--- --م-و-----لده في -شوال -س--نة --ا--حدي -وثمانين --و-خم---سما--ءة ---بدمشق و--سمع بها-- ---من اب-ي محمد --عبد- -الرحم--ن بن علي -بن -ا--	حديج من قبل ابي جعفر علي الصلاة لثنتي عشرة بقيت من ربيع الاخر وهو اول من خطب بالسواد وخرج الي ابي جعفر لعشر بقين من رمضان سنة اربع وخمسين وماءة واستخلف اخاه محمدا ورجع في اخرها ومات وهو وال ---------------مستهل صفر سنة خمس وخمسين وماءة واستخلف اخاه محمدا فكانت ولايته---- سنتين وشهرين فولي محمد بن عبد الرحمن بن معاوية بن خديج باستخلاف اخيه فاقره ابو جعفر علي الصلا-ة ومات وهو وال للنصف من شوال فكانت ولايته ثمانية اشه-ر ونصفا واستخلف موسي بن علي فولي موسي بن علي بن رباح باستخلاف محمد بن خديج فاقره ابو جعفر علي الصلاة وخرج القبط بهبيب في سنة ست وخمسي-ن فبعث اليهم وهزمهم وكان يروح الي المسجد ماشيا وصاحب -شرطته بين يديه يحمل الحربة واذا اقام صاحب الشرطة الجدود يقول له ارحم اهل البلاد فيقول ايها الامير ما يصلح الناس الا ما يفعل بهم وكان يحدث فيكتب الناس عنه ومات ابو جعفر لست خلون من ذي الحجة سنة ثمان وخمسين وماءة وبويع ابنه محمد المهدي فاقر موسي بن علي الي سابع	1852	702	427162304140555233	809134611832706985	242	866	38.799076080322266	29	0845Maqrizi.Muqaffa.Sham19Y0145334-ara1.completed	0845Maqrizi.Mawaciz.Shamela0011566-ara1.mARkdown
