begin	begin2	end	end2	gid	gid2	id	id2	matches	s1	s2	seq	seq2	uid	uid2	ch_match	align_len	matches_percentage	w_match	series_b1	series_b2
349	536	1272	1461	-8020384904724402078	-6636270028460100563	0845Maqrizi.Muqaffa.Sham19Y0145334-ara1.completed.ms1327	0845Maqrizi.Mawaciz.Shamela0011566-ara1.mARkdown.ms0796	170	بلاد فاذا وصلت بلادنا نرفع قدرك عن التعليم وتكون لنا سيدا وصوله معهم الي بلاد كتامة فلم يطمعهم وعلق الامر معهم علي الاستخارة وكان جلدا محتالا قد علم الحيل ثم اظهر لهم الاجابة بعد المسالة وسار معهم حتي انتهوا الي سوجمار حيث تلقاهم رجال من الشيعة فاخبروهم بخبر ابي عبد الله الشيعي فنظروا الي تعظيم الكتاميين اياه فرغبوا في نزوله عندهم حتي رموا عليه القرعة في من يضيقه ثم رحلوا حتي دخلوا حد كتامة يوم الخميس النصف --------------------------------------------------------------------------------------------------------------------------------------------------------------------------------------من ربيع الاول سنة ثمان وثمانين وماءتين فساله قوم من خيارهم ان ينزل عندهم فقال اين يكون فج الاخيار فنظر بعضهم الي بعض تعجبا وكانوا لم يذكروه في طريقهم ولا سموه له وانما اخذه من كلام صبيانهم فقالوا له عند بني سكتان فقال اليه نقصد ثم ناتي كل قوم منكم في موضعهم ونزورهم في بيوتهم فارضي بذلك قلوب الجميع وسار الي جبل يقال له ايكجان وفيه فج الاخيار فقال هذا فج الاخيار وما سمي الا بكم لقد جاء في بعض الروايات ان للمهدي هجرة تنبو به عن الاوطان ينصره فيها الاخيار من اهل ذلك الزمان قوم مشتق اسمهم من الكتمان ---فانتم هم كتا	للبلاد الا انت فانها موطاة ممهدة فخرج ابو عبد الله الي مكة وقصد حجاج كتامة فجلس قريبا منهم وسمعهم يتحدثون بفضاءل البيت فحدثهم في معناه فمالوا اليه وسالوه ان ياذن لهم في زيارته فلما زاروه سالوه عن مقصده فلم يخبرهم واوهمهم انه يريد مصر فسروا بصحبته ورحلوا وهو رفيقهم فشاهدوا من عبادته وزهده ما زادهم رغبة فيه هذا وهو يسالهم عن احوالهم وقباءلهم حتي صار يعرف جميع امورهم فلما وصلوا مصر هم بمفارقتهم فقالوا اي شء تطلب من مصر فقال اطلب التعليم بها فقالوا اذا كان قصدك هذا فبلادنا انفع لك وما زالوا به حتي سار معهم فلما وصلوا بلادهم اقترعوا فيمن يضيفه منهم ومن بقية اصحابهم ووصلوا به ارض كتامة للنصف من ربيع الاول سنة ثمان وثمانين وماءتين وكادوا يحتربون عليه ايهم ينزل عنده فابي ان ينزل عندهم وقال اين يكون فج الاخيار فعجبوا لذلك اذ لم يكونوا ذكروه له قط فدلوه عليه فسار اليه وقال هذا فج الاخيار وما سمي الا بكم ولقد جاء في الاثار للمهدي هجرة ---------------------------------------------------------------------------------------------------------------------------------------------------------------------------------------عن الاوطان ينصره فيها الاخيار من اهل ذلك الزمان قوم اسمهم مشتق من الكتمان وبخروجكم في هذا	1327	796	151596085637659644	-3645707940742318612	120	1108	15.342960357666016	18	0845Maqrizi.Muqaffa.Sham19Y0145334-ara1.completed	0845Maqrizi.Mawaciz.Shamela0011566-ara1.mARkdown
376	630	1104	1217	-8020384904724402078	-6636270028460100563	0845Maqrizi.Muqaffa.Sham19Y0145334-ara1.completed.ms2317	0845Maqrizi.Mawaciz.Shamela0011566-ara1.mARkdown.ms0748	230	لثلاث عشرة خلت من ربيع الاول سنة اثنتين وعشرين وثلاثماءة فنزل الجيزة مع الجند واظهر كتبا لابيه فانكر ذلك محمد بن علي الماذراءي وبعث محمد بن تكين الي حبشي بن احمد رءيس طاءفة المغاربة في جند مصر يامره واصحابه بالدخول في طاعته والانقياد اليه فابوا ذلك ودعي لمحمد بن تكين بالامارة فعزل الحسين بن علي بن معقل عن الشرط وولي مكانه بجكم الاعور وسار حبشي في اصحابه الي الصعيد ولحق به محمد بن عيسي النوشري فامروه عليهم وهم علي الدعاء لاحمد بن كيغلغ --ثم عدي- --حبشي النيل ال-ي الشرقية واق-بل -في- ---اصحاب----ه -ير-------يد ---ا--لفسطا-ط فعسكر محمد بن --ت--كين من برك-ة -المعافر الي- -الف--------ج -ثم -اتته ---طاءفة --من المغار--ب--ة فبيتت ع--س--كر--ه -ليلة --ا-لسبت لثلاث خلون من --ربيع الاخر فقتل --من ال--فر----يقين -جما--عة ---ثم التقو---ا --م---ن ---ا----لغد فانهزمت المغا--ربة -ور-----جع ----محمد بن -تكين فنزل- دار -الا--ما-ر--ة -واقب-ل احمد -بن كيغلغ	لثلاث عشرة خلت من ربيع الاول سنة اثنتين وعشرين فانكر المادراني ولايته وتعصب له طاءفة ودعي له بالامارة وخرج قوم الي الصعيد فيهم ابن -----------------------------------------------------------------------------------------------------------------------------------------------------------------------------------------------------------------------------------------------------------------النوشري فامروه عليهم وهم علي الدعاء لا----بن كيغلغ فنزل منية الاصبغ لثلاث خلون من رجب فلحق به كثير من اصحاب تكين ففر ابن تكين ليلا ودخل ابن كيغلغ المدينة لست خلون منه وكان مقام ابن تكين بالفسطاط ماءة يوم واثني عشر يوما وخلع القاهر وبويع ابو العباس الراضي بالله فعاد ابن تكين واظهر ان الراضي ولا-ه فخرج اليه العسكر وحاربوه فيما بين بلبيس وفاقوس فانهزم وجء به الي المدينة فحمل الي الصعيد فورد الخبر بان محمد بن طفج سار الي مصر بولاية الراضي له فبعث اليه ابن كيغلغ	2317	748	-723611389639998932	5294941185918224435	166	849	27.090694427490234	20	0845Maqrizi.Muqaffa.Sham19Y0145334-ara1.completed	0845Maqrizi.Mawaciz.Shamela0011566-ara1.mARkdown
1354	1131	1470	1260	-8020384904724402078	-6636270028460100563	0845Maqrizi.Muqaffa.Sham19Y0145334-ara1.completed.ms2870	0845Maqrizi.Mawaciz.Shamela0011566-ara1.mARkdown.ms1939	85	اليه- ---وال--مثو--ل -بين يديه فلما زالت الدولة الفاطمية علي يد السلطان صلاح الدين يوسف بن ايوب -قا-ل ال--قا--ضي الفاضل لصلاح الدين	الذهب من جملة حقوقها وهي باقية فلما زالت الدولة الفاطمية علي يد السلطان صلاح الدين يوسف انزل في منازل العز الملك المظفر --تقي الدين	2870	1939	6093058345909429182	5961901073380207669	67	131	64.885498046875	11	0845Maqrizi.Muqaffa.Sham19Y0145334-ara1.completed	0845Maqrizi.Mawaciz.Shamela0011566-ara1.mARkdown
821	82	1037	387	-8020384904724402078	-6636270028460100563	0845Maqrizi.Muqaffa.Sham19Y0145334-ara1.completed.ms0277	0845Maqrizi.Mawaciz.Shamela0011566-ara1.mARkdown.ms0734	151	---ه تب-را--- الي ا-لله عز وجل من----ه--- و-لعنه -لعن---ا ظاهرا وامر بل--عن--ه -ل----يلحقه ذلك --م--ن ---خوا-ص --ال-اول--يا-----ء ---و--ع--وا-م ا----ل--رعاي----ا ------اللهم العنه لعنا يفل حده ويتعس جده ويجعله مثلا للغابرين انك لا تصلح عمل المفسدين ---ي-ا رب ال---------عالمين وفاة ا-ب-ن طولون ثم خرج ---ا	فعله ابو احمد ولم اعلمه وامتنع من الشهادة والخلع وكان ذلك لاحدي عشرة خلت من ذي القعدة فبلغ ذلك الموفق فكتب الي عماله بلعن احمد بن طولون علي المنابر فلعن عليه بما صيغته اللهم العنه لعنا يفل حده ويتعس جده واجعله مثلا للغابرين انك لا تصلح عمل المفسدين ومضي احمد الي طرسوس فنازلها وكان البرد شديدا ثم رحل عنها	277	734	6400840624302328720	6987083807163518306	112	305	49.50819778442383	15	0845Maqrizi.Muqaffa.Sham19Y0145334-ara1.completed	0845Maqrizi.Mawaciz.Shamela0011566-ara1.mARkdown
1	455	467	1060	-8020384904724402078	-6636270028460100563	0845Maqrizi.Muqaffa.Sham19Y0145334-ara1.completed.ms0719	0845Maqrizi.Mawaciz.Shamela0011566-ara1.mARkdown.ms0480	165	ابن الامير ابي الاصبغ ابن الخليفة ابي الحكم ابن ابي مروان القرشي الاموي استخلفه ابوه عبد العزيز بن مروان علي الفسطاط لما خرج في سنة اربع وسبعين الي الاسكندرية ثم استخلفه مرة ثانية في سنة خمس وسبعين لما وفد علي اخيه عبد الملك بن مروان فلما بعث عبد الملك بن مروان يسال عبد العزيز -----------------------------------------------------------------------------------------------------------ان ينزل له عن ولاية العهد ليعهد الي الوليد وسليمان ولديه ابي ذلك وكتب اليه ان يكن لك ولد فلنا اولاد ويقضي الله ما -شاء ----وانك ---لو -را---يت ا-لاصب--غ -لسرك ولم --تقدم علي--ه احدا ف-لم --ي-ع-ش ال------اصب-غ ---الا قليلا و--	ثلاثة الاف رجل فيهم عبد الرحمن بن بحنس مولي ابن ابزي وهو الذي قتل ابن الزبير وخرج الي الاسكندرية في سنة اربع وسبعين ووفد علي اخيه عبد الملك في سنة خمس وسبعين وهدم جامع الفسطاط كله وزاد فيه من جوانبه كلها في سنة سبع وسبعين وامر بضرب الدنانير المنقوشة وقال ابن عفير كان لعبد العزيز الف جفنة كل يوم تنصب حول داره وكانت له ماءة جفنة يطاف بها علي القباءل تحمل علي العجل وكتب عبد الملك اليه ان ينزل له عن ولاية العهد ليعهد الي الوليد وسليمان -----فابي ذلك وكتب اليه ان يكن لك ولد فلنا اولاد ويقضي الله ما يشاء فغضب عبد الملك وقال فرق الله بيني وبينه فلم يزل به علي حتي رضي فقدم علي عبد العزيز فاخبره عن عبد الملك وعن	719	480	-331036127410690922	4665857538100624139	118	610	27.04918098449707	23	0845Maqrizi.Muqaffa.Sham19Y0145334-ara1.completed	0845Maqrizi.Mawaciz.Shamela0011566-ara1.mARkdown
1135	44	1609	680	-8020384904724402078	-6636270028460100563	0845Maqrizi.Muqaffa.Sham19Y0145334-ara1.completed.ms2752	0845Maqrizi.Mawaciz.Shamela0011566-ara1.mARkdown.ms0982	349	ال-خط بال-ايم--ان -ف--ي-- ----نسختي--ن احداهما في قصبة فضة -فل-ما-- -قبض عل---ي ال-ما-مو--ن انفذ ال-خليفة ي طل----ب --الايمان فنفذ ال--ي------ه ----ال-ذي ف--ي ---------القصبة ---فحر-قها لوق---ته--ا ---قال- ----ابن-- ال-م----ا-م-----و--ن و----ب----قيت -ا----لنسخة الاخري- ع---ندي فعدمتا --في -ال-حرك-----ا-ت ال-تي جرت وعا-د المامون -------ال--ي م------جلس----ه و----ا-----مر بتفرقة كسوة العيد والهبات وجملة العين ثلاثة الاف وثلاثماءة وسبعون دينارا ومن الكسوات ماءة قطعة وسبع قطع برسم الامراء المطوقين ا والاستاذين المحنكين وكاتب ال دست ومتولي حجبة الباب وغيره------------م-- وعدة ما ذبح في ثلاثة ايام النحر --------وفي- -عيد الغدير الفان وخمسماءة	النحر قال المسبحي وفي يوم عرفة يعني من سنة ثمانين وثلثماءة حمل يانس صاحب الشرطة السماط وحمل ايضا علي بن سعد المحتسب سماطا اخر وركب العزيز بالله يوم النحر فصلي وخطب علي العادة ثم نحر عدة نوق بيده وانصرف الي قصره فنصب السماط والمواءد واكل ونحر بين يديه وامر بتفرقة الضحايا علي اهل الدولة وذكر مثل ذلك في باقي السنين وقال ابن المامون في عيد النحر من سنة خمس عشرة وخمسماءة وامر بتفرقة -عيد النحر والهب-ة وجملة العين ثلاثة الاف وثل-ثماءة وسبعون دينارا ومن الكسوات ماءة قطعة وسبع قطع برسم الامراء المطوقين-- والاستاذين المحنكين وكاتب ال-دست ومتولي حجبة الباب وغيرهم من المستخدمين وعدة ما ذبح ---ثلاثة ايام النحر في هذا العيد وعيد الغدير الفان وخمسماءة	2752	982	6762763686784196496	5614143917114791114	276	645	54.10852813720703	34	0845Maqrizi.Muqaffa.Sham19Y0145334-ara1.completed	0845Maqrizi.Mawaciz.Shamela0011566-ara1.mARkdown
628	28	1549	999	-8020384904724402078	-6636270028460100563	0845Maqrizi.Muqaffa.Sham19Y0145334-ara1.completed.ms0636	0845Maqrizi.Mawaciz.Shamela0011566-ara1.mARkdown.ms1475	438	النار احسن جواري اذا اصبحت جارك في لحدي فانك قد اوصيت بالجار ابن مماتي ا اسعد بن مهذب بن مينا بن ابي المليح زكريا بن قدامة بن ابي مليح مينا القاضي الاسعد شرف الدين ابو المكارم ابن الخطير ابي سعيد المعروف بابن مماتي ولي ديوان الجيش بعد ابيه الخطير فلما استبد ---------------------------------------------------------------------------------------------------السلطان صلاح الدين يوسف بن ايوب بسلطنة مصر استقر في نظر الدواوين من سنة ست وثمانين وخمسماءة واختص بالقاضي الفاضل وحظي عنده وكان يسميه بلبل المجلس لما يري من حسن خطابه وله عدة مصنفات منها كتاب تلقين اليقين فيه كلام علي قوله صلي الله عليه وسلم بني الاسلام علي خمس وكتاب حجة الحق علي الخلق في التحذير من سوء عاقبة الظلم وهو كبير وكان السلطان صلاح الدين يكثر النظر فيه وقال عنه القاضي الفاضل وقفت من الكتب علي ما لا تحصي عدته فما رايت والله كتابا يكون قبالة باب منه وانه من اهم ما طالعه الملوك وله ايضا كتاب قوانين الدواوين صنعه للملك العزيز عثمان ابن صلاح الدين ذكر فيه ما يتعلق بدواوين مصر ورسومها واحوالها وما يجري فيها وهو اربعة اجزاء ضخمة والذي يقع في ايدي الناس	الزنانير علي اوساطهم ومنعهم من ارخاء الذءابة التي تسمي اليوم بالعذبة فكتب لاسد الدين يا اسد الدين ومن عدله يحفظ فينا سنة المصطفي كفي غيارا شد اوساطنا فما الذي اوجب كشف القفا فلم يسعفه بطلبته ولا مكنه من ارخاء الذءابة وعند ما ايس من ذلك اسلم فقدم علي الدواوين حتي مات فخلفه ابنه ابو المكارم اسعد بن مهذب الملقب بالخطير علي ديوان الجيش واستمر في ذلك مدة ايام السلطان صلاح الدين يوسف بن ايوب وايام ابنه الملك العزيز عثمان وولي نظر الدواوين ايضا -------واختص بالقاضي الفاضل وحظي عنده وكان يسميه بلبل المجلس لما يري من حسن خطابه وصنف عدة مصنفات منها تلقين اليقين فيه الكلام علي حديث ---------------------بني الاسلام علي خمس وكتاب حجة الحق علي الخلق في التحذير من سوء عاقبة الظلم وهو كبير وكان السلطان صلاح الدين يكثر النظر فيه وقال فيه القاضي الفاضل وقفت من الكتب علي ما لا تحصي عدته فما رايت والله كتابا يكون قبالة باب منه وانه والله من اهم ما طالعه الملوك وكتاب قوانين الدواوين صنفه للملك العزيز فيما يتعلق بدواوين مصر ورسومها واصولها ---------------------واحوالها وما يجري فيها وهو اربعة اجزاء ضخمة والذي يقع في ايدي الناس	636	1475	6890798417888247440	539765943162770846	344	1020	42.94117736816406	76	0845Maqrizi.Muqaffa.Sham19Y0145334-ara1.completed	0845Maqrizi.Mawaciz.Shamela0011566-ara1.mARkdown
2	681	519	1266	-8020384904724402078	-6636270028460100563	0845Maqrizi.Muqaffa.Sham19Y0145334-ara1.completed.ms2753	0845Maqrizi.Mawaciz.Shamela0011566-ara1.mARkdown.ms0982	378	واحد وستون راسا منها نوق ماءة وسبعة عشر وبقر اربعة وعشرون وجاموس عشرون هذا ما ينحره الخليفة ويذبحه بيده في مصلي العيد وفي المنحر ---------وباب الساباط ويذبح الجزارون من الكباش الفين واربعماءة راس والذي ا--نفق علي- ------الاسمطة في ---هذه ال--ايام خارجا عما يعمل بالدار المامونية من الاسمطة وخارجا عن ------القصور ----الح--لو----ي --والقصور ا--ل------منفوخ ال---تي --تصن-ع- بدار الفطرة الف وثلاثماءة وستة وعشرون دينارا ----------------ومن السكر برسم القصور والقطع المنفوخ اربعة وعشرون قنطارا --منها عن قصرين في اول يوم خاصة اثنا عشر قنطارا و عن المنفوخ عن الثلاثة الايام اثنا عشر قنطارا وكان --	واحد وستون راسا تفصيله نوق ماءة وسبعة عشر راسا يقر اربعة وعشرون راسا جاموس عشرون راسا هذا الذي ينحره ويذبحه الخليفة بيده في المصلي والنحر وباب الساباط ويذبح الجزارون من الكباش الفين واربعماءة راس والذي اشتملت عليه نفقات الاسمطة في الايام المذكورة خارجا عما يعمل بالدار المامونية من الاسمطة وخارجا عن اسمطة القصور عند الحرم وخارجا عن القصور الحلواء والقصور المنفوخ المصنوعة بدار الفطرة الف وثل-ثماءة وستة وعشرون دينارا وربع وسدس دينار ومن السكر برسم القصور والقطع المنفوخ اربعة وعشرون قنطارا تفصيله عن قصرين في اول يوم خاصة اثنا عشر قنطارا-- ---المنفوخ عن --ثلاثة الايام اثنا عشر قنطارا وقال في	2753	982	4619088850671248499	5614143917114791114	308	593	63.743675231933594	51	0845Maqrizi.Muqaffa.Sham19Y0145334-ara1.completed	0845Maqrizi.Mawaciz.Shamela0011566-ara1.mARkdown
1189	768	1571	1181	-8020384904724402078	-6636270028460100563	0845Maqrizi.Muqaffa.Sham19Y0145334-ara1.completed.ms0164	0845Maqrizi.Mawaciz.Shamela0011566-ara1.mARkdown.ms0842	359	-ال---- يتشوق الي -------اخ--وانه- -----بمصر --م---ن --ابيا-ت -الطوي-ل هل الريح ان سارت مشرقة تسري تءدي تحياتي الي ساكني مصر فما خطرت الا بكيت صبابة وحملتها ما ضاق عن حمله صدري لاني اذا هبت قبولا بنشرهم شممت نسيم المسك من ذلك النشر فكم لي بالاهرام او دير نهية مصاءد غزلان المكابد والقفر الي جيزة الدنيا بما قد تضمنت جزيرتها ذات المواخير والجسر وبالمقس والبستان للعين منظر انيق الي شاطي الخليج الي القصر وفي -سر-دوس	بالرشيق يتشوق الي مصر وقد خرج عنها في سنة ست وثمانين وثلثماءة من قصيدة هل الريح ان سارت مشرقة تسري تءدي تحياتي الي ساكني مصر فما خطرت الا بكيت صبابة وحملتها ما ضاق عن حمله صدري لاني اذا هبت قبولا بنشرهم شممت نسيم المسك من ذلك النشر فكم لي بالاهرام او دير نهية مصايد غزلان المطايد والقفر الي جيزة الدنيا وما قد تضمنت جزيرتها ذات المواخ-ر والجسر وبالمقس والبستان للعين منظر انيق الي شاطء الخليج الي القصر وفي بءر دوس	164	842	3604106528449308081	3532022777936397069	287	414	86.71497344970703	61	0845Maqrizi.Muqaffa.Sham19Y0145334-ara1.completed	0845Maqrizi.Mawaciz.Shamela0011566-ara1.mARkdown
289	1127	752	1704	-8020384904724402078	-6636270028460100563	0845Maqrizi.Muqaffa.Sham19Y0145334-ara1.completed.ms1000	0845Maqrizi.Mawaciz.Shamela0011566-ara1.mARkdown.ms0507	320	-طلع ----صباح يوم الاربعاء الا وقد احاطوا------- بالفرنج ----و--و-ضعوا فيهم السيوف --ي-قتل-ون وياسرون حت---ي بل---غت عدة -ا---------لقتلي عشرة الاف -في قول ال-مقل- وثلاثين -ال-فا- --في ق--ول --ا--لمكثر -واستشهد من المسل--مين نحو ما---ءة رجل وال---تجا --ري-دافرنس --ملك --ا-لفرنج ----في -خاصته الي تل -----الم----نية و-طل-ب الامان فامنهم الطواشي جمال الدين محسن الصالحي وانزلهم علي امان---------ه- وساقهم الي المنصور- وقي-----د ------ا---لملك ريدا--فرنس --وسجن-- في-- --دا-ر فخر الدين ابراهيم بن لقمان كاتب الانشاء بالمنصورة ووكل به الطواشي صبيح المعظمي و--سجن معه اخوه واجري له ما-- ي----كفيه --	وطلع الفجر من يوم الاربعاء ----وقد احاط المسلمون بالفرنج وقتلوا واسروا منهم -كثيرا حتي قيل ان -عدد من قتل من الفرسان علي فارسكور يزيد علي عشرة الاف واسر من الخيالة والرجال والصناع والسوقة ما يناهز ماءة الف ونهب من المال والذخاءر والخيول والبغال ما لا يحصي وانحاز الملك رواد فرنس واكابر الفرنج الي تل ووقفوا مستسلمين وسالوا الامان فامنهم الطواشي جمال الدين محسن الصالحي و-نزلوا علي امانة واحيط بهم وسيقوا الي المنصورة فقيد رواد فرنس واعتقل في الدار التي كان ينزل فيها القاضي فخر الدين ابراهيم بن لقمان كاتب الانشاء ----------ووكل به الطواشي صبيح المعظمي واعتقل معه اخوه و-رتب له راتب يحمل اليه في	1000	507	4873032443071517097	-5274633034774460267	244	595	53.78151321411133	33	0845Maqrizi.Muqaffa.Sham19Y0145334-ara1.completed	0845Maqrizi.Mawaciz.Shamela0011566-ara1.mARkdown
