begin	begin2	end	end2	gid	gid2	id	id2	matches	s1	s2	seq	seq2	uid	uid2	ch_match	align_len	matches_percentage	w_match	series_b1	series_b2
23	1255	360	1551	-8020384904724402078	-6636270028460100563	0845Maqrizi.Muqaffa.Sham19Y0145334-ara1.completed.ms1967	0845Maqrizi.Mawaciz.Shamela0011566-ara1.mARkdown.ms1957	251	ال-وقوف علي بابه من نصف الليل ومعهم المشاعل والشموع الي الصبح فاذا كان الصباح ركب ولا يراهم ولا يرونه لانه عند ما يخرج اما ان يرفع راسه الي السماء تيها واما ان يعرج علي طريق غير طريقهم التي هم بها واما ان يامر الجاندارية التي في ركابه بضرب الناس وطردهم من طريقه ويكون الرجل الجليل قد وقف علي بابه طول الليل اما من اوله او من نصفه بغلمانه	الرءساء علي بابه من نصف الليل ومعهم المشاعل والشمع وعند الصباح يركب فلا يراهم ولا يرونه لانه --------------------------اما ان يرفع راسه الي السماء تيها واما ان يعرج الي طريق غي---ر---- التي هم بها واما ان يامر الج-ن-ادرة التي في ركابه بضرب الناس وطردهم من طريقه ويكون الر-----ج--ل قد وقف علي بابه طول الليل اما من اوله او من نصفه بغلمانه	1967	1957	7324651351589480750	1515482809746484920	197	338	74.2603530883789	46	0845Maqrizi.Muqaffa.Sham19Y0145334-ara1.completed	0845Maqrizi.Mawaciz.Shamela0011566-ara1.mARkdown
557	819	1106	1434	-8020384904724402078	-6636270028460100563	0845Maqrizi.Muqaffa.Sham19Y0145334-ara1.completed.ms1559	0845Maqrizi.Mawaciz.Shamela0011566-ara1.mARkdown.ms0735	250	بن -ابي السا-ج علي م----يسر-ة ---ابي- ---ال-جيش فزحزحتها و-حمل -ابو- -الجي-ش -ب-نفسه -م----ن -ال---قلب ي--ريد ابن ابي -ال--ساج فانهزم --وتبعه جيشه وعاد ابو -ال-جيش -الي ---د---م-شق وبين -يد-يه خل-ق كثير -من ال--ا-----سري وعد--ة عظيمة من -ر-ءوس القتلي- --وكتب- الي ا--بن ابي ---ال---ساج --ي---وبخه --بعد- ---ما -خلع علي اب-----------نه -ووص-له --ور-ده --اليه- وعا--د الي --م----صر ---فدخلها- --يوم-- الخميس لست بقين من جمادي الاخرة سنة ست وسبعين ثم خرج الي الاسكندرية يوم الاحد لاربع خلون من شوال منها ورابط اياما وعاد الي مصر واتي الخبر بان يازمان الخادم دعا لخمارويه بطرسوس والثغور في جمادي الاخرة سنة سبع وسبعين فبعث الي-----ه --ب---ثلاثين ---الف د--ينار -ليفرقها في سبيل الله وخمسين ث-	به فالق الخادم الي مصر في رجب ذكر فيه ان المعتمد والموفق وابنه كتبوه بايديهم وبولاية خمارويه وولده ثلاثين سنة علي مصر والشامات ثم قدم خمارويه -سلخ رجب فامر بالدعاء لابي احمد الموفق وترك الدعاء عليه وجعل علي المظالم بمصر محمد بن ع-بدة بن حرب وبلغه مسير محمد بن ابي الساج الي اعماله فخرج اليه في ذي القعدة ولقيه شيبة العقاب من دمشق فانهزم اصحاب خمارويه وثبت هو فحاربه حتي هزمه اقبح هزيمة وعاد الي مصر فدخلها لست بقين من جمادي الاخرة سنة ست وسبعين ثم خرج الي الاسكندرية لاربع خلون من شوال وورد الخبر انه دعي له بطرسوس --------------------------------------------------------------------في جمادي الاخرة سنة سبع وسبعين وخرج الي الشام لسبع عشرة من ذي القعدة ومات الموفق-- في س-نة ثمان وسبعين ثم	1559	735	-4992772397271652951	4604933076655267988	171	688	36.33720779418945	19	0845Maqrizi.Muqaffa.Sham19Y0145334-ara1.completed	0845Maqrizi.Mawaciz.Shamela0011566-ara1.mARkdown
99	6	641	761	-8020384904724402078	-6636270028460100563	0845Maqrizi.Muqaffa.Sham19Y0145334-ara1.completed.ms1025	0845Maqrizi.Mawaciz.Shamela0011566-ara1.mARkdown.ms1515	317	ال-بركة وبقي-----ت تل--ك الثياب حتي كفن- -في بعضها ص--لي ---ا-لله عل--يه وسلم---- و---لما- --توجه عمرو بن-- ا--ل-----عا-ص بالجنود ا-لي -مصر بلغ ذلك المقو-قس --فسار من ال-ا-سكن-----د---ري-ة ا--ل-ي -مص----ر وجهز ال---جيوش لق---تال--ه ------فم-----ا زال---- ---عم--رو --يهزم-هم -حتي نزل علي الحصن وقد تحصن -به ال--مقوقس وخندق حوله -وجعل--- لل-خن---دق -ابوا--با -وبث في ا-----فن---ي--ته --حسك -الحديد فلما -----اشتد الحصا---ر----- ---------------------------تنحي المقوقس و-م-عه ---اكابر القبط وخرجوا من باب الحصن القبلي ودونهم جماعة يقاتلون المسلمين حتي لحقوا ب--جزيرة -----ال---فسطا---ط ----و---قطع الجسر وذلك في جري النيل وت----رك ال-مندقور عل----ي ال-حصن فلم- يزل يقاتل -المسلمين ---الي -ا-ن غل--ب و-صار- --الي ----المقوقس بال-جزيرة فارسل -المقوقس -ال--ي-- -عمرو ان	الصناعة يعني صناعة السفن الحربية اي كانت بها دار الصناعة وبها كان الجنان والمختار وبها كان الهودج الذي بناه الخليفة الامر با-حكام الله لمحبوبته البدوية وبها بني الملك الصالح نجم الدين ايوب القلعة الصالحية وبها الي اليوم مقياس النيل وساورد من اخبار الروضة هنا ما لا تجده مجتمعا في غير هذا الكتاب قال ابن عبد الحكم وقد ذكر محاصرة المسلمين للحصن فلما راي القوم الجد من المسلمين علي فتح الحصن والحرص وراوا صبرهم علي القتال ورغبتهم فيه خافوا ان يظهروا عليهم فتنحي المقوقس وجماعة من اكابر القبط وخرجوا من باب الحصن القبلي ودونهم جماعة يقاتلون ا---لعرب ---فلحقوا بالجزيرة موضع الصناعة اليوم وامروا بقطع الجسر وذلك في جري النيل وتخلف في الحصن بعد المقوقس الاعرج فلما خاف --فتح باب الحصن خرج هو واهل القوة والشرف وكانت سفنهم ملصقة بالحصن ثم لحقوا بالمقوقس بالجزيرة قال وكان	1025	1515	-6361478351677868001	7234726466195702522	231	764	41.49214553833008	17	0845Maqrizi.Muqaffa.Sham19Y0145334-ara1.completed	0845Maqrizi.Mawaciz.Shamela0011566-ara1.mARkdown
1320	510	1505	757	-8020384904724402078	-6636270028460100563	0845Maqrizi.Muqaffa.Sham19Y0145334-ara1.completed.ms0220	0845Maqrizi.Mawaciz.Shamela0011566-ara1.mARkdown.ms2098	137	--لي بن-- -محمد بن جعفر الصادق بن محمد الباقر بن علي زين العابدين بن الحسين بن علي بن ابي طالب ------الشريف --ا-بو ا--لعباس--- ال---قن---ا--ءي ا-ل--مص-ري -ال----شا-فعي -ا--مه ---ابنة ال-شي-----خ ابي -حسن الشاذلي كان ي------رعي الغنم ال--ي ---ان ب-	الله عنها اسحاق بن جعفر الصادق بن محمد الباقر بن علي زين العابدين بن الحسين بن علي بن ابي طالب عليهم السلام وكان يقال له اسحاق المءتمن وكان من اهل الصلاح والخير والفضل والدين روي عنه الحديث وكان ابن كاسب اذا حدث عنه يقول حدثني الثقة الرضي اسحاق بن	220	2098	-4203179388461932707	1653948267834729601	101	247	55.4655876159668	17	0845Maqrizi.Muqaffa.Sham19Y0145334-ara1.completed	0845Maqrizi.Mawaciz.Shamela0011566-ara1.mARkdown
686	414	1575	1491	-8020384904724402078	-6636270028460100563	0845Maqrizi.Muqaffa.Sham19Y0145334-ara1.completed.ms1259	0845Maqrizi.Mawaciz.Shamela0011566-ara1.mARkdown.ms1045	553	--ارطال --بدرهم و---كانت -العادة انه يشتر-ي- --ل--لديو--ان ال-سلطاني- في كل سن-ة غل---ة --بم---ا--ءة الف ------د-ي-----نار وتجعل -متجر-ا -فلما ع---اد ----قاضي -ا-لقضاة الي- ال--قا-------هرة م-ثل بحضر-ة ال------خليفة المستنصر وعرفه ما من ال-له -تع---ال-ي به في هذا- الي---و---م من ارخاص السعر وتوفر ال--ناس --علي الد-عا---ء -ل----امير المءمنين و-----ا-ن ال--له جلت قدرته --فعل ذلك وحل --اسعاد ال--ناس بحسن نية ----ا--مير --المءم----نين في رعيته بغي-ر --م------وجب -و-لا فاعل- له بل بلطف ال------له --تعال-ي- واتفاق قريب ---يسير وقص ع------ل--ي-ه -ال-خ-بر -------ثم -قال ------يا------ -امير المءمنين ان المتجر الذي يقام بالغلة في ه او-في مضرة علي المسلمين وربما انحط السعر عن مشتراها فلا يمكن بيعها حتي تتغير في المخازن وتتلف والمصلحة ان نقيم متجرا لا كلفة ----علي الناس فيه ويفيد اضعاف فاءدة الغلة ولا يخشي عليه من تغير في المخازن ولا انحطاط سعر وهو الخشب-- والصابون والحديد والرصاص والعسل وما اشبه ذلك فامضي المستنصر له ما راه واستمر ذلك ودام الرخاء علي الناس ----مدة سنين ثم قصر الني-ل في سنة سبع --واربعين ---بعد خمس سنين -من نظره في ا-لوزا--ر-ة ولم يك-ن بمخ-ازن السلط--ان من--- الغلة -ال-ا ما ينصر	الاعمال البحرية والبحيرة والجزيرتان والغربية والكفور والاعمال الشرقية فيحمل منها اليسير ويحمل باقيها الي الاسكندرية ودمياط وتنيس ليسير الي ثغر عسقلان وثغر صور وانه كان يسير اليهما في كل سنة ماءة وعشرون الف اردب منها العسقلان خمسون -الفا ولصور سبعون الفا فيصير هناك ذخيرة ويباع منها عند الغني عنها قال وكان متحصل الديوان في كل سنة الف الف اردب وذكر جامع السيرة البازورية ان المتجر كان يقام به للديوان من الغلة وان الوزير ابا محمد البازوري قال للخليفة المستنصر وهو يومءذ يتقلد وظيفة قاضي القضاة وقد قصر النيل في سنة اربع واربعين واربعماءة ولم يكن بالمخازن السلطانية غلال فاشتدت المسغبة بامير المءمنين ان المتجر الذي يقام بالغلة في-ه او في مضرة علي المسلمين وربما اقحط السعر من مشتراها ولا يمكن بيعها ---فتتغير في المخازن وتتلف وا-------نه يقام متجر- لا كلفة فيه علي الناس---- ويفيد اضعاف فاءدة الغلة ولا يخشي عليه من تغير في المخازن ولا انحطاط سعر وهو الصابون والخشب-- والحديد والرصاص والعسل وما اشبه ذلك فامضي ال-خليفة ---ما راه واستمر ذلك ودام الرخاء علي الناس وتوسعوا ذكر المناظر التي كانت للخلفاء الفاطميين ومواضع نزههم ما كان -لهم فيها من امور جميلة وكان للخلفاء الفاطميين مناظر كثيرة بالقاهرة ومصر	1259	1045	-5676063994035751626	4440634371157136535	411	1101	50.22706604003906	56	0845Maqrizi.Muqaffa.Sham19Y0145334-ara1.completed	0845Maqrizi.Mawaciz.Shamela0011566-ara1.mARkdown
631	774	1141	1484	-8020384904724402078	-6636270028460100563	0845Maqrizi.Muqaffa.Sham19Y0145334-ara1.completed.ms1590	0845Maqrizi.Mawaciz.Shamela0011566-ara1.mARkdown.ms0321	156	الحهم ووعدهم بالاحسان اليهم وتزعم القبط ان طوطيس هذا اول الفراعنة السبعة وهو فرعون بن ابراهيم خليل الرحمن صلوات الله عليه وقبل بل فراعنة مصر من ولد دان بن فهلوج بن امراز بن اشوذ بن سام بن نوح والمشهور انهم من العماليق منهم الربان بن الوليد وهو فرعون ابراهيم ومنهم الوليد بن مصعد فرعون موسي ومنهم سنار بن علوان ويقال فرعون ابراهيم اسمه ---------------------------------------------------------------------------------------------------------------------------------------------------------------عمرو بن امرء القيس بن بابليون بن حمير بن سبا بن يشجب بن يعرب بن قحطان و-قيل ---فراعنة مصر من --عملا-ق --ا---------لاول- -بن ----لاوز بن --سام ب--------ن -----ن--وح وقيل فر-عون ابراهيم هو -سنان الاسل بن علوان بن عبيد بن	الي مصر وامرهم بالخروج الي الجيش فوجدوهم قد ماتوا هم ودوابهم فهابه الكهنة مهابة لم يهابوها احدا قبله وعمر طويلا وغاب فلم يعلم خبره وقال ابن عبد الحكم ان كلكلي ابن حزابا ملكهم نحو ماءة سنة ثم مات ولا ولد له فملك اخوه ماليا بن حزابا قال ابن وصيف شاه وقام اخوه ماليا وكان شرها كثير الاكل والشرب منفردا بالرفاهية غير ناظر في شء من الحكمة وجعل امر البلد الي وزيره واشتغل بالنساء وكان له من النساء ثمانون امراة فهجم عليه ابنه طوطيس وهو سكران فقتله وقتل امراة كانت عنده وملك بعده ابنه طوطيس ويقال انه عمرو بن امرء القيس بن بابليون بن حمير بن سبا بن يشجب بن يعرب بن قحطان ويقال الوليد بن الريان وانه احد فراعنة مصر من ولد دان بن فهلوج بن امراز بن اشود بن سام بن نوح وقيل فراعنة مصر من ولد عملاق الاول بن -لاود بن -سام بن	1590	321	-8454123347591874220	5843197161467622091	106	712	21.910112380981445	20	0845Maqrizi.Muqaffa.Sham19Y0145334-ara1.completed	0845Maqrizi.Mawaciz.Shamela0011566-ara1.mARkdown
1226	238	1488	584	-8020384904724402078	-6636270028460100563	0845Maqrizi.Muqaffa.Sham19Y0145334-ara1.completed.ms0287	0845Maqrizi.Mawaciz.Shamela0011566-ara1.mARkdown.ms1521	204	ه-ا ال--ا حظا-ي--ا-ه وثقا--ته-- ----فلما وصل-------ت -ال-ن-عل- -----ال-----ي الموفق -بعثها- --الي ابن ------طول--ون ----وقال -ا ---له ال------رسو--ل ال--ذي احضرها يقول لك الموفق من قدر علي اخذ هذه النعل من الموضع الذي تعرفه اليس هو -قادر ا علي اخذ روحك وو الل----ه- -------لقد قام عليه اخذه هذه النعل بخمسين الف دينار فعند ذلك---- --خاف ا-حمد --بن -طو	هذا الحصن ثمانين الف دينار ذهبا وكان مما حمل احمد بن طولون علي بناء الحصن ان الموفق اراد ان يشغل قلبه فسرقت نعله من بيت حظية لا يدخله الا ثقاته وبعث الموفق ا-ليه- فقال له الرسول من قدر علي اخذ هذه النعل من الموضع الذي تعرفه اليس هو بقادر --علي اخذ روحك فو الله ايها الامير لقد قام عليه اخذ- هذه النعل بخمسين الف دينار فعند ذلك امر ببناء الحصن وقال ابو	287	1521	5311698515138681413	4690018432563153863	151	351	58.119659423828125	24	0845Maqrizi.Muqaffa.Sham19Y0145334-ara1.completed	0845Maqrizi.Mawaciz.Shamela0011566-ara1.mARkdown
162	1	858	995	-8020384904724402078	-6636270028460100563	0845Maqrizi.Muqaffa.Sham19Y0145334-ara1.completed.ms0150	0845Maqrizi.Mawaciz.Shamela0011566-ara1.mARkdown.ms2098	377	عب-د ال--عزيز ويحيي ابن ابي -كثير --وسعد --بن ا-براهيم وابو -----صالح ا-لسمان --وابو عبد الله الاع-ز وعبد ا-ل-----كريم ابن ابي-- ال-مخارق --وابو سل--مة ------بن عبد ---ا--ل-----ر-حمن وابن اخيه سعي-د بن عب--د -ا---لله -بن قارظ ا----لقا-رظي رو--ي --له ا-ل--ب-خا-----ري في كتا-ب ال-ا-د--ب-- --خارج الصحيح -واخرج -له مسلم وابو --دا-ود والترمذي والنساءي وهو -ثقة --مشهور ابن ا-ل-ا-عرج -الحسيني ابراهيم بن-- -عبد الله --بن ---القاسم- -الا--عرج بن عبد ال---له- ---بن -ال------قا-----سم بن ----محمد --ال----------------ديبا-------ج ------بن جعفر الصادق بن محمد الباقر بن علي زين العابدين بن الحسين بن علي بن ابي طالب عليهم السلام --ا-مه ام ولد -توفي بمصر في شوال سن---ة --ثمان وخمسين و---ثل--ا---ثماءة ابو اسح-اق --اليابري ا-ب--را-هيم بن- ----عبد--- ال-له ---بن -محمد بن -------ا--ل---ق-اسم-- ----اب-و اسحاق --الكلب-ي يعرف بال-يابري-- -ن--س-بة ال-ي- ---يا--برة -من ك--و--رة ---ب-----ا-جة -في-- ------غرب- ال----ان-دلس -رحل --حا--------جا-- ولقي -با-لاسكندرية اب-----ا-- ----------عبد الله ---محمد -بن الح----	ابنة الحسن بن الحسن -بن علي وامها ام ولد تزوج ام كلثوم -اخت نفيسة عبد الله بن علي بن عبد الله بن عباس رضي الله عنهم ثم خلف عليها الحسن بن زيد بن علي بن الحسن بن علي واما علي وابراهيم وزيد اخوة نفيسة من ابيها فامهم ام ولد تدعي ام عبد الحميد واما عبيد الله بن الحسن بن زيد فامه الزاءدة بنت بسطام بن عمير بن قيس الشيباني واما اسماعيل واسحاق فهما -لامي ولد وكان اسماعيل -من اهل الفضل وال-خير صاحب صوم ونسك وكان يصوم يوما ويفطر يوما واما يحيي بن زيد فله مشهد معروف بالمشاهد ياتي ذكره ان شاء الله تعالي وتزوج بنفيسة رضي الله عنها اسحاق بن جعفر الصادق بن محمد الباقر بن علي زين العابدين بن الحسين بن علي بن ابي طالب عليهم السلام وكان يقال -له اسحاق المءتمن وكان من اهل الصلاح والخير والفضل والدين روي عنه الحديث وكان ابن كاسب اذا حدث عنه يقول حدثني الثقة الرضي اسحاق بن جعفر وكان له عقب بمصر منهم بنو الرقي وبحلب بنو زهرة وولدت نفيسة من اسحاق ولدين هما القاسم وام كلثوم لم يعقبا واما جد نفيسة وهو زيد بن الحسن بن علي فروي عن ابيه وعن جابر وابن عباس وروي عنه ابنه وكانت بينه وبين عبد الله بن محمد ابن الحنفية	150	2098	6703424996194822624	1653948267834729601	252	1000	37.70000076293945	23	0845Maqrizi.Muqaffa.Sham19Y0145334-ara1.completed	0845Maqrizi.Mawaciz.Shamela0011566-ara1.mARkdown
625	618	1167	1417	-8020384904724402078	-6636270028460100563	0845Maqrizi.Muqaffa.Sham19Y0145334-ara1.completed.ms2448	0845Maqrizi.Mawaciz.Shamela0011566-ara1.mARkdown.ms1530	296	-ل-ي قزوين -و---زنجا--ن و-اليا علي ال-ضي-اع ---والاعشار ------به-ا---- ال-سد----يد ابن --حنا ا محمد ب-ن -سليم بفتح ا--ل---سي--ن المه-ملة ا--بن -حنا ----بكسر ال-حا-----ء ا---لمه---ملة القاضي سديد الدين ا--بو عبد الله --و--الد الوزير ال-ص-----اح-ب -به-اء الد-ين علي-- -ب----------ن محمد--- --بن -----سلي-م بن حنا كا-ن حنا نصراني--ا--- --وت-رقي محمد في ال----خدم ال-ديوا--ني-ة ----حتي -باشر -دي------------وان ال-جي-ش بديار -مصر --ي----و-م ا--ل-اربعاء سابع عشرين -شعب--ان سنة اثنتي----ن -وعشري---ن --وستماءة وشهد عند---------- قاضي القضاة عماد الدين ابي القاسم عبد الرحمن بن محمد بن عبد العلي--- -------ابن السكري --وس---م---ع ا--------لحد----يث من ابي --ع------بد--- ------ال------ل---ه م---حمد -بن حمد ال--ا-ر-تاحي و---ا-بي -محمد عبد ال-له بن محمد المحلي -وكان-- --محبا في ا-لصال-حي-ن -وا---ه---ل ال-خ-	صلاح الدين يوسف بن ايوب ولده الملك العزيز عثمان الي مصر ومعه عمه الملك العادل وكتب الي الملك المظفر بان يسل-م لهما البلاد ويقدم عليه الي الشام فلما ورد عليه الكتاب ووصل ابن عمه الملك العزيز وعمه الملك العادل شق عليه خروجه من الديار المصرية وتحقق انه لا عود له اليها ابدا فوقف هذه المدرسة التي تعرف اليوم في مصر بالمدرسة التقوية التي كانت تعرف بمنازل العزو وقف عليها الجزيرة بكمالها وسافر الي عمه فملكه حماه ولم يزل الحال كذلك الي ان ولي الملك الصالح نجم الدين ايوب فاستاجر الجزيرة من القاضي فخر الدين ابي محمد عبد العزيز بن قاضي القضاة عماد الدين ابي القاسم عبد الرحمن بن محمد بن عبد العلي بن عبد القادر السكري مدرس المدرسة المذكورة لمدة ستين سنة في دفعتين كل دفعة قطعة فالقطعة الاولي من جامع غين الي المناظر طولا وعرضا من البحر الي البحر واستاجر القطعة الثانية وهي با-قي ارض الجزيرة بما فيها من النخل	2448	1530	-8186537210161340818	-168857893442258257	205	801	36.95380783081055	14	0845Maqrizi.Muqaffa.Sham19Y0145334-ara1.completed	0845Maqrizi.Mawaciz.Shamela0011566-ara1.mARkdown
839	974	1334	1277	-8020384904724402078	-6636270028460100563	0845Maqrizi.Muqaffa.Sham19Y0145334-ara1.completed.ms0588	0845Maqrizi.Mawaciz.Shamela0011566-ara1.mARkdown.ms0734	103	-بو الجيش احمد الواسطي علي جيش الي الشام في يوم الخميس سادس ذي الحجة سنة سبعين وماءتين وجهز بعده سعدا الايسر علي جيش اخر وكان سعد علي الحرب وابن الواسطي علي تدبير الجيش والنفقات فاتفق انه وقع بين سعد وبين الواسطي كلام اقتضي وقوع الاختلاف بينهما فبعث ابو الجيش لما بلغه ذلك ابا جعفر بن ابا فاصلح بينهما وكان الواسطي خاءفا من ابي الجيش ان يوقع به لما اشار به من قتل العباس فدخل سعد دمشق وتاخر الواسطي بطبرية بعد ما كتب الي ابي العباس احمد ابن الموفق يصغر امر خمارويه ويحرضه علي المسير اليه ----وضمن -كتا-	عبد ال-له احمد الواسطي علي جيش الي الشام لست خلون من ذي الحجة وعقد لسعد الاعسر علي جيش اخر وبعث بمراكب في البحر لتقيم علي السواحل الشامية فنزل الواسطي فلسطين وهو خاءف من خمارويه ان يوقع به لانه كان اشار عليه بقتل اخيه العباس فكتب الي ابي احمد ------------------------------------------------------------------------------------------------------------------------------------------------------------------------------------------------------الموفق يصغر امر خمارويه ويحرضه علي المسير اليه فاقبل من بغداد	588	734	-522282184971836018	6987083807163518306	79	502	20.517929077148438	14	0845Maqrizi.Muqaffa.Sham19Y0145334-ara1.completed	0845Maqrizi.Mawaciz.Shamela0011566-ara1.mARkdown
